{
  "requirementId": "REQ-0006",
  "state": "planned",
  "risk": "low",
  "updatedAt": "2026-10-13T12:34:05.720Z",
  "history": [
    {
      "from": null,
      "to": "intake",
      "actor": "harness-agent",
      "at": "2026-10-13T12:11:16.309Z",
      "note": "Harness Run created from https://github.com/xXFengXx/Starter-Codex/issues/9"
    },
    {
      "from": "intake",
      "to": "clarified",
      "actor": "Codex",
      "at": "2026-10-13T12:34:04.036Z",
      "note": "\"Contract normalized with six testable acceptance criteria\""
    },
    {
      "from": "clarified",
      "to": "planned",
      "actor": "Codex",
      "at": "2026-10-13T12:34:05.720Z",
      "note": "\"Implementation plan and traceability completed; awaiting human approval\""
    }
  ]
}
