{
  "requirementId": "REQ-0005",
  "state": "planned",
  "risk": "high",
  "updatedAt": "2026-10-12T08:45:00.040Z",
  "history": [
    {
      "from": null,
      "to": "intake",
      "actor": "Codex",
      "at": "2026-10-12T00:00:00.000Z",
      "note": "根据已确认的设计访谈创建 Harness 门禁加固需求"
    },
    {
      "from": "intake",
      "to": "clarified",
      "actor": "Codex",
      "at": "2026-10-12T08:44:47.734Z",
      "note": "设计访谈已确认，合同与验收标准完整"
    },
    {
      "from": "clarified",
      "to": "planned",
      "actor": "Codex",
      "at": "2026-10-12T08:45:00.040Z",
      "note": "实施计划与验收追踪已完成"
    }
  ]
}
